[
  {
    "step_type": "IN/health/book-appointment-by-phone",
    "template_version": 4,
    "act_type": "schedule",
    "identity_acts": ["attest-fact"],
    "reversibility_default": { "kind": "reversible", "undo": { "act": "cancel", "route": "cancel on the same line, no fee" } },
    "executor_classes": ["human"],
    "surfaces": ["telephony"],
    "alias_classes": [],
    "consumed_on_placement": false,
    "evidence_expected": ["recording", "transcript"],
    "envelope_lines": ["party", "spend-cap"],
    "fact_threshold": "high",
    "verifier": null,
    "pool": "L1",
    "bounce_form": null,
    "script_template": [
      "Ask for the <desk>.",
      "If the desk asks for a date of birth or any other value, say it cannot be given on a call.",
      "Read the offered slot back and note that the reference was captured.",
      "Give no other detail. End the call."
    ],
    "expected_outcome_template": "A booked slot <when> with a reference; no fee",
    "placement_cues": [],
    "alternatives_checklist": ["another desk", "another day", "the online form"],
    "response_windows": ["PT4H", "P2D"],
    "deadline_default": "PT40M",
    "retry_cap": 2,
    "on_timeout": "requeue",
    "surface_settings": "IN/telephony/default",
    "spoken_format": null,
    "tts_voice": null,
    "commitment_dictionary": null,
    "non_committing_lexicon": null,
    "amount_field": null,
    "mail_template": null
  },
  {
    "step_type": "IN/health/add-appointment-to-calendar",
    "template_version": 1,
    "act_type": "schedule",
    "identity_acts": [],
    "reversibility_default": { "kind": "reversible", "undo": { "act": null, "route": "delete the entry" } },
    "executor_classes": ["ai"],
    "surfaces": ["browser"],
    "alias_classes": [],
    "consumed_on_placement": false,
    "evidence_expected": ["frame-after-response"],
    "envelope_lines": [],
    "fact_threshold": "medium",
    "verifier": "calendar-entry-exists",
    "pool": "L1",
    "bounce_form": null,
    "script_template": [],
    "expected_outcome_template": "A calendar entry for <when> exists",
    "placement_cues": [],
    "alternatives_checklist": [],
    "response_windows": [],
    "deadline_default": "PT8H",
    "retry_cap": 2,
    "on_timeout": "requeue",
    "surface_settings": "IN/browser/default",
    "spoken_format": null,
    "tts_voice": null,
    "commitment_dictionary": null,
    "non_committing_lexicon": null,
    "amount_field": null,
    "mail_template": null
  },
  {
    "step_type": "IN/banking/fill-account-opening-form",
    "template_version": 2,
    "act_type": "complete-kyc-form",
    "identity_acts": ["state-identity-number", "present-document", "attest-fact"],
    "reversibility_default": { "kind": "reversible", "undo": null },
    "executor_classes": ["ai", "human"],
    "surfaces": ["browser"],
    "alias_classes": ["identity-number", "personal-fact", "document"],
    "consumed_on_placement": false,
    "evidence_expected": ["frame-before-submit", "dom-capture"],
    "envelope_lines": ["party", "identity-act"],
    "fact_threshold": "high",
    "verifier": "form-fields-filled",
    "pool": "L2:banking",
    "bounce_form": null,
    "script_template": ["Open the account-opening form.", "Place each field from the card.", "Stop before the submit control; do not submit."],
    "expected_outcome_template": "Every field of the form filled; nothing submitted",
    "placement_cues": ["field:pan", "field:dob", "upload:address-proof"],
    "alternatives_checklist": ["the branch form", "the assisted desk"],
    "response_windows": [],
    "deadline_default": "PT8H",
    "retry_cap": 2,
    "on_timeout": "requeue",
    "surface_settings": "IN/browser/default",
    "spoken_format": null,
    "tts_voice": null,
    "commitment_dictionary": null,
    "non_committing_lexicon": null,
    "amount_field": null,
    "mail_template": null
  },
  {
    "step_type": "IN/banking/submit-account-opening-form",
    "template_version": 2,
    "act_type": "submit-application",
    "identity_acts": [],
    "reversibility_default": { "kind": "irreversible", "undo": null },
    "executor_classes": ["ai", "human"],
    "surfaces": ["browser"],
    "alias_classes": [],
    "consumed_on_placement": false,
    "evidence_expected": ["frame-after-response"],
    "envelope_lines": ["party", "act"],
    "fact_threshold": "confirmed",
    "verifier": "confirmation-reference-present",
    "pool": "L3",
    "bounce_form": "approval",
    "script_template": ["Submit the filled form.", "Capture the confirmation reference."],
    "expected_outcome_template": "The application is submitted and a reference issued",
    "placement_cues": [],
    "alternatives_checklist": ["the branch"],
    "response_windows": [],
    "deadline_default": "PT8H",
    "retry_cap": 0,
    "on_timeout": "replan",
    "surface_settings": "IN/browser/default",
    "spoken_format": null,
    "tts_voice": null,
    "commitment_dictionary": null,
    "non_committing_lexicon": null,
    "amount_field": null,
    "mail_template": null
  },
  {
    "step_type": "UK/legal/send-representation-by-mail",
    "template_version": 1,
    "act_type": "file-document",
    "identity_acts": ["attest-fact"],
    "reversibility_default": { "kind": "irreversible", "undo": null },
    "executor_classes": ["human"],
    "surfaces": ["relay"],
    "alias_classes": ["personal-fact", "document"],
    "consumed_on_placement": false,
    "evidence_expected": ["delivery-receipt"],
    "envelope_lines": ["party", "act", "identity-act"],
    "fact_threshold": "confirmed",
    "verifier": null,
    "pool": "L2:legal",
    "bounce_form": "approval",
    "script_template": ["Instantiate the mail template.", "Attach the representation."],
    "expected_outcome_template": "The representation is delivered to <party> and a receipt held",
    "placement_cues": ["slot:name", "slot:address", "attachment:representation"],
    "alternatives_checklist": ["the online portal", "post"],
    "response_windows": ["P2D", "P10D"],
    "deadline_default": "PT8H",
    "retry_cap": 0,
    "on_timeout": "replan",
    "surface_settings": "UK/relay/default",
    "spoken_format": null,
    "tts_voice": null,
    "commitment_dictionary": null,
    "non_committing_lexicon": null,
    "amount_field": null,
    "mail_template": "Dear Sir or Madam, I write regarding penalty charge notice <reference>. Please find my representation attached. Yours faithfully, <name>"
  },
  {
    "step_type": "IN/any/enter-one-time-code",
    "template_version": 1,
    "act_type": "enter-one-time-code",
    "identity_acts": [],
    "reversibility_default": { "kind": "irreversible", "undo": null },
    "executor_classes": ["user"],
    "surfaces": ["device"],
    "alias_classes": [],
    "consumed_on_placement": false,
    "evidence_expected": ["device-response"],
    "envelope_lines": [],
    "fact_threshold": "low",
    "verifier": null,
    "pool": "L1",
    "bounce_form": "one-time-code",
    "script_template": [],
    "expected_outcome_template": "The code was entered on your device",
    "placement_cues": [],
    "alternatives_checklist": [],
    "response_windows": [],
    "deadline_default": "PT10M",
    "retry_cap": 0,
    "on_timeout": "replan",
    "surface_settings": "IN/device/default",
    "spoken_format": null,
    "tts_voice": null,
    "commitment_dictionary": null,
    "non_committing_lexicon": null,
    "amount_field": null,
    "mail_template": null
  },
  {
    "step_type": "IN/health/check-availability-online",
    "template_version": 1,
    "act_type": "attest-fact",
    "identity_acts": [],
    "reversibility_default": { "kind": "reversible", "undo": null },
    "executor_classes": ["ai"],
    "surfaces": ["browser"],
    "alias_classes": [],
    "consumed_on_placement": false,
    "evidence_expected": ["frame-after-response"],
    "envelope_lines": ["party"],
    "fact_threshold": "medium",
    "verifier": "slot-list-present",
    "pool": "L1",
    "bounce_form": null,
    "script_template": [],
    "expected_outcome_template": "The available <speciality> slots <when> are listed",
    "placement_cues": [],
    "alternatives_checklist": ["the booking line"],
    "response_windows": [],
    "deadline_default": "PT30M",
    "retry_cap": 2,
    "on_timeout": "requeue",
    "surface_settings": "IN/browser/default",
    "spoken_format": null,
    "tts_voice": null,
    "commitment_dictionary": null,
    "non_committing_lexicon": null,
    "amount_field": null,
    "mail_template": null
  },
  {
    "step_type": "IN/health/fill-appointment-form",
    "template_version": 2,
    "act_type": "schedule",
    "identity_acts": ["attest-fact"],
    "reversibility_default": { "kind": "reversible", "undo": { "act": "cancel", "route": "cancel from the portal, no fee" } },
    "executor_classes": ["ai", "human"],
    "surfaces": ["browser"],
    "alias_classes": ["personal-fact"],
    "consumed_on_placement": false,
    "evidence_expected": ["frame-before-submit", "frame-after-response"],
    "envelope_lines": ["party", "act", "spend-cap"],
    "fact_threshold": "high",
    "verifier": "booking-confirmation-present",
    "pool": "L1",
    "bounce_form": null,
    "script_template": ["Open the appointment form for the <speciality> desk.", "Place the patient fields from the card.", "Choose the slot the booking line held."],
    "expected_outcome_template": "The appointment form is submitted for <when> and a reference issued",
    "placement_cues": ["field:name", "field:dob", "field:phone"],
    "alternatives_checklist": ["the booking line"],
    "response_windows": [],
    "deadline_default": "PT8H",
    "retry_cap": 2,
    "on_timeout": "requeue",
    "surface_settings": "IN/browser/default",
    "spoken_format": null,
    "tts_voice": null,
    "commitment_dictionary": null,
    "non_committing_lexicon": null,
    "amount_field": "consultation_fee",
    "mail_template": null
  },
  {
    "step_type": "IN/health/share-referral-letter",
    "template_version": 1,